{
  "$schema": "http://json-schema.org/draft-07/schema#",
  "title": "SupportProvider",
  "type": "object",
  "required": ["id", "name", "category", "verified"],
  "properties": {
    "id": { "type": "string", "pattern": "^SVC[A-Z0-9]+$" },
    "name": { "type": "string" },
    "category": {
      "type": "string",
      "enum": ["police", "legal", "counseling", "shelter", "medical", "financial", "cyber"]
    },
    "phone": { "type": ["string", "null"] },
    "area": { "type": ["string", "null"] },
    "city": { "type": ["string", "null"] },
    "is_24x7": { "type": "boolean" },
    "verified": { "type": "boolean" },
    "latitude": { "type": ["number", "null"] },
    "longitude": { "type": ["number", "null"] },
    "notes": { "type": ["string", "null"] }
  }
}